{
  "$schema": "http://json-schema.org/draft-07/schema#",
  "$id": "https://sudish007.github.io/shubhvela/schema/lesson.schema.json",
  "title": "Lesson file",
  "description": "corpus/lessons/<lang>.json: the >= 20 Learn lessons (spec section 7, F32). `body` is a list of paragraphs totalling 350-450 words (a five-minute read) and may contain only the `{placeholders}` listed under `placeholders` below; the app resolves each from the reader's own ChartData / dasha tree / panchang at birth (see packages/content/src/lessons.ts LESSON_PLACEHOLDERS for the resolver contract). `terms` are glossary ids linked from the lesson (every one must exist in corpus/glossary). `tryIt` is the 'Try it on your chart' row: an expo-router `route` inside the app and the ui key (`label`) of the card it opens. `unlocksLevel` is the corpus snippet level (2 or 3) that 'Mark done' unlocks for the Why? sheets; lessons never unlock anything commercial.",
  "placeholders": {
    "name": "The reader's profile name.",
    "moonSign": "Sidereal Moon sign name in the UI language (ChartData.planets Mo.sign).",
    "moonSignLord": "Lord of the Moon sign (planet name).",
    "lagna": "Lagna sign name, or the UI string lesson.lagnaUnknown when the birth time is unknown (ChartData.lagna).",
    "lagnaLord": "Lord of the Lagna sign, or lesson.lagnaUnknown when unknown.",
    "sunSign": "Sidereal Sun sign name (ChartData.planets Su.sign).",
    "nakshatra": "Birth (Moon) nakshatra name (Mo.nakshatra).",
    "pada": "Birth nakshatra pada 1-4 (Mo.pada).",
    "nakshatraLord": "Vimshottari lord of the birth nakshatra (planet name).",
    "mahaLord": "Running mahadasha lord today (dasha(chart).mahas).",
    "mahaEnds": "Date the running mahadasha ends, formatted in the profile time zone.",
    "antarLord": "Running antardasha lord today.",
    "antarEnds": "Date the running antardasha ends, formatted.",
    "balanceLord": "Dasha lord at birth (DashaTree.balanceAtBirth.lord).",
    "balanceYears": "Balance of that dasha at birth in years, one decimal.",
    "saturnSign": "Saturn's natal sign name (Sa.sign).",
    "saturnHouseFromMoon": "Saturn's natal sign counted from the Moon sign, 1-12.",
    "saturnHouse": "Saturn's natal whole-sign house from the first-house sign, 1-12 (Sa.house).",
    "jupiterSign": "Jupiter's natal sign name (Ju.sign).",
    "jupiterHouse": "Jupiter's natal house 1-12 (Ju.house).",
    "marsHouse": "Mars's natal house 1-12 (Ma.house).",
    "venusSign": "Venus's natal sign name (Ve.sign).",
    "mercurySign": "Mercury's natal sign name (Me.sign).",
    "rahuHouse": "Rahu's natal house 1-12 (Ra.house).",
    "ketuHouse": "Ketu's natal house 1-12 (Ke.house).",
    "moonHouse": "Moon's natal house 1-12 (Mo.house; 1 in Moon-chart mode).",
    "sunHouse": "Sun's natal house 1-12 (Su.house).",
    "moonDegree": "Moon's degree inside its sign, whole degrees (Mo.degree).",
    "moonNavamsaSign": "Moon's sign in the D9 (varga(chart,'D9') Mo.sign).",
    "lagnaNavamsaSign": "Lagna sign in the D9, or lesson.lagnaUnknown.",
    "tenthLord": "Lord of the 10th house (houses[9].lord), counted from the first-house sign.",
    "seventhLord": "Lord of the 7th house (houses[6].lord).",
    "birthTithi": "Tithi name at birth (panchang at birth).",
    "birthVara": "Weekday name of the birth day in the UI language.",
    "birthYoga": "Panchang yoga name at birth.",
    "birthKarana": "Panchang karana name at birth.",
    "birthPlace": "Profile place name (short form).",
    "birthTz": "Profile time-zone id (meta.tz).",
    "ayanamsa": "Ayanamsa name from settings (meta.ayanamsa, Lahiri by default).",
    "ayanamsaDegrees": "Ayanamsa value at birth in degrees, two decimals (meta.ayanamsaDegrees).",
    "nodeMode": "Node mode from settings (mean or true) as the UI string.",
    "todayMoonSign": "Today's Moon sign name at the profile place.",
    "todayMoonHouseFromMoon": "Today's Moon sign counted from the birth Moon sign, 1-12.",
    "todayTara": "Today's Tara bala name (Janma ... Param Mitra).",
    "todayTithi": "Today's tithi name at sunrise.",
    "todayNakshatra": "Today's nakshatra name at sunrise.",
    "todayVara": "Today's weekday name.",
    "rahuKaalToday": "Today's Rahu Kaal as a start-end range in the profile time zone.",
    "sunriseToday": "Today's sunrise time at the profile place.",
    "sunsetToday": "Today's sunset time at the profile place.",
    "nextJanmaTithi": "Date of the reader's next janma tithi (tithiEventDates), formatted.",
    "savLagna": "Sarvashtakavarga bindus of the first house (ashtakavarga(chart).sav[0]).",
    "savTenth": "Sarvashtakavarga bindus of the 10th house.",
    "yogaCount": "Number of formed yogas in the chart (yogas(chart) formed && !cancelledBy).",
    "firstYoga": "Name of the first formed yoga, or lesson.noYoga when none.",
    "kpLagnaSubLord": "KP sub-lord of the Lagna cusp, or lesson.lagnaUnknown when the time is unknown.",
    "ephemeris": "Ephemeris name string from ChartData.meta.ephemeris."
  },
  "type": "array",
  "items": {
    "type": "object",
    "required": ["id", "n", "title", "minutes", "body", "terms", "tryIt", "unlocksLevel", "review"],
    "additionalProperties": false,
    "properties": {
      "id": { "type": "string", "pattern": "^lesson-[0-9]{2}$" },
      "n": { "type": "integer", "minimum": 1, "maximum": 40 },
      "title": { "type": "string", "minLength": 3 },
      "minutes": { "type": "integer", "minimum": 1, "maximum": 30 },
      "body": { "type": "array", "minItems": 1, "items": { "type": "string", "minLength": 20 } },
      "terms": { "type": "array", "minItems": 1, "items": { "type": "string", "pattern": "^[a-z0-9-]+$" } },
      "tryIt": {
        "type": "object",
        "required": ["route", "label"],
        "additionalProperties": false,
        "properties": {
          "route": { "type": "string", "pattern": "^/[A-Za-z0-9()/_?=&.-]+$" },
          "label": { "type": "string", "pattern": "^[a-z]+(\\.[A-Za-z0-9_-]+)+$" }
        }
      },
      "unlocksLevel": { "type": "integer", "enum": [2, 3] },
      "review": { "type": "string", "enum": ["draft", "reviewed"] }
    }
  }
}
