[
  {"id":"lesson-01","n":1,"title":"कुंडली क्या है","minutes":5,"body":["कुंडली उस क्षण और उस स्थान के आकाश का नक्शा है जब और जहाँ आपका जन्म हुआ, और यह उसी निरयण राशिचक्र में बनाई जाती है जिसका उपयोग ज्योतिष करता है। यह कोई भविष्यवाणी नहीं है। यह एक रिकॉर्ड है: {birthPlace} से देखने पर सूर्य, चंद्र, पाँच दृश्य ग्रह और दो चंद्र-पात (राहु और केतु) कहाँ खड़े थे, और पूर्व में कौन-सी राशि उदय हो रही थी। इस ऐप में बाकी सब कुछ, दिन की टिप्पणी, दशाएँ, योग, मिलान के अंक, उसी रिकॉर्ड पर लगाया गया कोई नियम है।","यहाँ हर पाठ के लिए आपकी अपनी कुंडली ही उदाहरण है। {name}, आपके चंद्र {moonSign} में थे और आपकी उदय राशि, यानी लग्न, {lagna} थी। यही दो राशियाँ वह ढाँचा हैं जिस पर बाकी कुंडली टिकी है। घर के ज़्यादातर पंचांग जब आपकी राशि पूछते हैं तो उनका मतलब चंद्र राशि होता है; लग्न वह है जो पूरे जन्म-समय वाली कुंडली इसमें जोड़ती है।","कुंडली में बारह भाव हैं, हर राशि के लिए एक, जो पहले भाव से गिने जाते हैं। Shubhvela में जन्म समय ज्ञात हो तो पहले भाव में आपकी लग्न राशि होती है, और ज्ञात न हो तो आपकी चंद्र राशि। हर भाव जीवन के कुछ विषयों को समेटता है: पहला भाव स्वयं और शरीर है, चौथा घर और माता, सातवाँ साझेदारी, दसवाँ काम और सार्वजनिक दायित्व। किसी भाव में बैठा ग्रह उसी भाव के संदर्भ में पढ़ा जाता है।","ग्रहों के अपने अर्थ भी होते हैं, और वे जिस राशि में बैठे हों उसके अनुसार बली या निर्बल होते हैं। आपके {moonSignLord}, यानी आपकी चंद्र राशि के स्वामी, और आपके {lagnaLord}, यानी लग्न के स्वामी, वे दो ग्रह हैं जिन्हें पढ़ने वाला सबसे पहले देखता है। आगे के पाठ बल-स्थिति, भाव-स्वामी और उस विंशोत्तरी दशा को समझाते हैं जो ठहरी हुई कुंडली को समय-रेखा में बदल देती है।","आगे बढ़ने से पहले ईमानदारी की दो बातें। पहली, कुंडली उतनी ही सही है जितना सही जन्म समय और स्थान टाइप किया गया था; लग्न कुछ ही मिनटों में बदल सकता है, और जो कुछ भी अनिश्चित समय पर निर्भर है उस पर ऐप “लगभग” का टैग लगाता है। दूसरी, ऐप आपकी कुंडली से जो भी वाक्य निकालता है, उसके साथ एक “क्यों?” बटन होता है जो नियम, उसके इनपुट और उसका शास्त्रीय स्रोत दिखाता है। यहाँ कुछ भी छिपा नहीं है, और कुछ भी भविष्य का वचन नहीं है।","अपनी कुंडली अभी खोलें और उसमें चंद्र और लग्न ढूँढ़ें। किसी एक पर टैप करें; जो शीट खुलती है वह उसी तरह की व्याख्या है जैसी इस पाठ ने अभी दी, बस उस एक स्थिति के लिए लिखी हुई।"],"terms":["kundli","lagna","rashi","bhava","jyotish","chandra-kundli"],"tryIt":{"route":"/(tabs)/charts","label":"charts.title"},"unlocksLevel":2,"review":"draft"},
  {"id":"lesson-02","n":2,"title":"राशियाँ और भाव","minutes":5,"body":["निरयण राशिचक्र बारह राशियों का एक वृत्त है, हर राशि तीस अंश चौड़ी, जो मेष से शुरू होकर मीन पर समाप्त होता है। राशियाँ तारों के सापेक्ष स्थिर हैं। भाव स्थिर नहीं हैं: वे उस राशि से गिने जाते हैं जो आपकी कुंडली में पहले स्थान पर है, इसलिए एक ही दिन अलग-अलग घंटों में जन्मे दो लोगों के ग्रह तो एक ही राशियों में होते हैं, पर भाव अलग-अलग।","आपकी कुंडली में पहला भाव {lagna} है। वहाँ से आगे गिनने पर राशि {moonSign} भाव {moonHouse} में पड़ती है, और {sunSign} में बैठे सूर्य भाव {sunHouse} में पड़ते हैं। Shubhvela संपूर्ण-राशि भाव पद्धति का उपयोग करता है, जो सबसे पुरानी और सबसे सरल परंपरा है: हर राशि एक भाव है, इसलिए न बीच के किसी मान का अनुमान लगाना पड़ता है और न किसी भाव-संधि पर बहस होती है। कुंडली मेनू का चलित दृश्य दूसरा विकल्प दिखाता है, जिसमें भावों की सीमाएँ लग्न के मध्य-बिंदु से खींची जाती हैं।","राशि बताती है कि ग्रह कैसे काम करता है; भाव बताता है कि वह कहाँ काम करता है। मेष, सिंह और धनु अग्नि राशियाँ हैं, जिन्हें सीधा और तेज़ पढ़ा जाता है। वृषभ, कन्या और मकर पृथ्वी राशियाँ हैं, जिन्हें स्थिर और व्यावहारिक पढ़ा जाता है। मिथुन, तुला और कुंभ वायु राशियाँ हैं, जिन्हें मिलनसार और तर्कशील पढ़ा जाता है। कर्क, वृश्चिक और मीन जल राशियाँ हैं, जिन्हें भावुक और अंतर्मुखी पढ़ा जाता है। ये परंपरा के वर्णन हैं, किसी परीक्षण के परिणाम नहीं, और ऐप इन्हें इसी रूप में दिखाता है।","भाव कई वर्गों में बँटते हैं। केंद्र, यानी पहला, चौथा, सातवाँ और दसवाँ भाव, कुंडली के स्तंभ हैं और उनमें बैठे ग्रहों को प्रमुखता देते हैं। त्रिकोण, यानी पहला, पाँचवाँ और नौवाँ भाव, शुभ समूह हैं। छठा, आठवाँ और बारहवाँ भाव दुःस्थान हैं, जहाँ ग्रह कठिनाई, ऋण, हानि या एकांत के बीच काम करते पढ़े जाते हैं। दूसरा, तीसरा और ग्यारहवाँ भाव इनके बीच में आते हैं: संसाधन, परिश्रम और लाभ।","एक उपयोगी आदत: जब दिन की टिप्पणी किसी भाव का नाम ले, तो संख्या को यों ही मान लेने के बजाय उसे अपनी कुंडली पर गिनें। {lagna} को एक मानकर शुरू करें और उत्तर भारतीय शैली में घड़ी की विपरीत दिशा में या दक्षिण भारतीय शैली में घड़ी की दिशा में आगे बढ़ें; भावों की संख्याएँ नहीं बदलतीं, केवल चित्र बदलता है। “भाव” कार्ड बारहों पंक्तियाँ राशि, उसके स्वामी और उसमें बैठे ग्रहों के साथ दिखाता है, हर एक के साथ एक “क्यों?” बटन।","अभी आज़माएँ: “भाव” कार्ड खोलें और वह भाव ढूँढ़ें जिसमें आपके चंद्र बैठे हैं। फिर उसके सामने की राशि ढूँढ़ें, चंद्र से सातवीं; यह जोड़ी मिलान वाले पाठ में फिर आती है।"],"terms":["rashi","bhava","kendra","trikona","dusthana","bhava-chalit","mesha","meena"],"tryIt":{"route":"/(tabs)/charts?card=houses","label":"charts.houses"},"unlocksLevel":2,"review":"draft"},
  {"id":"lesson-03","n":3,"title":"चंद्र और सत्ताईस नक्षत्र","minutes":5,"body":["यदि लग्न कुंडली का ढाँचा है, तो चंद्र उसकी घड़ी हैं। चंद्र लगभग सत्ताईस दिनों में पूरा राशिचक्र पार करते हैं, इसलिए वे हर ढाई दिन में राशि बदलते हैं और लगभग रोज़ नक्षत्र बदलते हैं। “आज” टैब आपके बारे में जो कुछ कहता है, उसका ज़्यादातर हिस्सा वहीं से शुरू होता है जहाँ आपके जन्म-चंद्र खड़े थे।","सत्ताईस नक्षत्र राशिचक्र को तेरह अंश बीस मिनट के बराबर चापों में बाँटते हैं, और हर नक्षत्र का नाम उस तारा-समूह पर है जिसके पास से चंद्र गुज़रते हैं। आपके जन्म-चंद्र {nakshatra} में, पद {pada} में, {moonSign} के {moonDegree} अंश पर थे। हर नक्षत्र का एक विंशोत्तरी स्वामी होता है; आपका {nakshatraLord} है, और यही ग्रह तय करता है कि आपका जन्म किस दशा में हुआ, जिस बात को दशा वाला पाठ आगे उठाता है।","पद नक्षत्र का चौथाई भाग है, तीन अंश बीस मिनट चौड़ा। चार पदों से एक नक्षत्र बनता है, और नौ पदों से एक राशि, इसलिए पद D9 कुंडली के खाने भी हैं। इसीलिए ज़्यादातर शास्त्रीय नियमों के लिए अंश से ज़्यादा नक्षत्र और पद महत्व रखते हैं: यही वह माप है जिसमें शास्त्र लिखे गए थे।","दो दैनिक माप सीधे जन्म-चंद्र से आते हैं। चंद्र बल आज की चंद्र राशि को आपकी जन्म-चंद्र राशि से गिनता है और पहले, तीसरे, छठे, सातवें, दसवें और ग्यारहवें भाव को अनुकूल पढ़ता है; आज चंद्र {todayMoonSign} में हैं, आपकी राशि से भाव {todayMoonHouseFromMoon} में। तारा बल आज के नक्षत्र को आपके जन्म-नक्षत्र से नौ-नौ के चक्र में गिनता है; आज की गिनती {todayTara} देती है। दोनों “आज” टैब पर एक “क्यों?” बटन के साथ दिखते हैं जो गिनती बताता है।","और कुछ न हो तो चंद्र ही सहारा हैं। जब जन्म समय अज्ञात हो, Shubhvela लग्न की गणना नहीं कर सकता, इसलिए वह चंद्र कुंडली बनाता है जिसमें आपकी चंद्र राशि पहले भाव में होती है, और शीर्षक में यह बात लिख देता है। दशाएँ, चंद्र बल, तारा बल, साढ़े साती और मिलान के कूट सब केवल चंद्र पर निर्भर हैं, इसलिए वे मान्य रहते हैं; केवल लग्न पर आधारित पंक्तियाँ अनुमान लगाने के बजाय छोड़ दी जाती हैं।","“ग्रह” कार्ड खोलें और चंद्र की पंक्ति पर टैप करें। शीट नक्षत्र, पद, स्वामी और अंश बताती है, और हर संस्कृत शब्द को शब्दकोश से जोड़ती है। फिर “आज” टैब देखें और चंद्र बल और तारा बल की पंक्तियाँ ढूँढ़ें; वहाँ की संख्याएँ उसी चंद्र से आज की गिनती हैं जिसके बारे में आपने अभी पढ़ा।"],"terms":["nakshatra","pada","chandra-bala","tara-bala","janma-nakshatra","chandra-kundli"],"tryIt":{"route":"/(tabs)/charts?card=planets","label":"charts.planets"},"unlocksLevel":2,"review":"draft"},
  {"id":"lesson-04","n":4,"title":"लग्न और अनुमानित समय","minutes":5,"body":["लग्न वह राशि है जो जन्म के क्षण जन्म-स्थान से देखने पर पूर्वी क्षितिज पर उदय हो रही होती है। पृथ्वी दिन में एक बार घूमती है, इसलिए बारहों राशियाँ एक-एक करके उदय होती हैं, और लग्न लगभग हर दो घंटे में बदलता है, अक्षांश के अनुसार कुछ राशियों के लिए जल्दी और कुछ के लिए धीरे। आपका लग्न {lagna} है; लग्नेश, यानी उस राशि के स्वामी ग्रह, {lagnaLord} हैं।","इसी गति के कारण जन्म समय इतना महत्व रखता है। अस्पताल के रिकॉर्ड में लिखे समय वाली कुंडली एक बात है; “भोर के आसपास” की याद वाले समय की कुंडली दूसरी बात। Shubhvela दोनों को अलग-अलग तरह से लेता है। प्रोफ़ाइल बनाते समय आप समय को ठीक-ठीक ज्ञात, या पंद्रह, तीस या साठ मिनट के भीतर अनुमानित, या अज्ञात के रूप में चिह्नित कर सकते हैं।","अनुमानित समय होने पर ऐप कुंडली की गणना दर्ज क्षण पर और अनिश्चितता की खिड़की के दोनों सिरों पर भी करता है। यदि उस खिड़की के भीतर लग्न या कोई ग्रह राशि-सीमा पार करता है, तो उस मान पर “लगभग” का टैग लगता है, ताकि आप जानें कि वह पड़ोस की राशि भी हो सकती है। वही टैग तब भी दिखता है जब सही समय होने पर भी कोई ग्रह राशि-सीमा से एक अंश के भीतर बैठा हो, क्योंकि अयनांश का छोटा-सा अंतर उसे खिसका सकता है।","अज्ञात समय होने पर लग्न बिल्कुल नहीं दिखाया जाता। कुंडली चंद्र कुंडली बन जाती है, शीर्षक यह बताता है, और हर वह पंक्ति जिसे लग्न चाहिए, जिसमें भाव, भाव-स्वामी, KP भाव-संधि और लग्न पर आधारित योग शामिल हैं, छोड़ दी जाती है। जिन पंक्तियों को केवल चंद्र चाहिए, वे रहती हैं। ऐप अज्ञात समय की जगह चुपचाप दोपहर या सूर्योदय कभी नहीं भरता; यदि आप कोई समय आज़माना चाहें, तो आप उसे टाइप करते हैं और टैग बताता है कि उस पर क्या-क्या निर्भर है।","जन्म समय की जाँच को परंपरा में जन्म-समय शुद्धि (रेक्टिफ़िकेशन) कहा जाता है, और यह कोई बटन नहीं, एक लंबा अभ्यास है। इस ऐप में इसका ईमानदार रूप सरल है: यदि समय अनिश्चित है, तो प्रोफ़ाइल में यही लिखें और “लगभग” टैग को वही समझें जो वे हैं, इस बात का कथन कि रिकॉर्ड किस बात का समर्थन कर सकता है और किसका नहीं।","“कुंडली” टैब से अपनी प्रोफ़ाइल खोलें और देखें कि समय कैसे दर्ज है। यदि वह अनुमानित के रूप में चिह्नित है, तो कुंडली पर वापस आएँ और “लगभग” टैग ढूँढ़ें; हर टैग की “क्यों?” शीट बताती है कि खिड़की से कितना खिसकाव होता है।"],"terms":["lagna","lagnesh","udaya-lagna","chandra-kundli","ayanamsa"],"tryIt":{"route":"/(tabs)/charts","label":"charts.title"},"unlocksLevel":2,"review":"draft"},